{
  "$schema": "../../../docs/contracts/artifact-contracts/module-interface-manifest.schema.json",
  "accessibility": {
    "keyboard_navigation": true,
    "reduced_motion": "supported",
    "screen_reader_labels": true
  },
  "authority_boundary": {
    "direct_domain_writes": false,
    "may_grant_capabilities": false,
    "menu_visibility_is_authorization": false,
    "presentation_only": true
  },
  "description": "Presentation-only entry points for an admitted isolated SenTient workbench. All outputs remain candidate material until external owner acceptance.",
  "home_route_id": "sentient.workbench",
  "icon_ref": null,
  "localization_refs": [],
  "manifest_id": "sentient.module-interface",
  "manifest_version": "1.0.0",
  "module_id": "sentient",
  "offline_behavior": {
    "fallback_route_id": "sentient.workbench",
    "module_state": "degraded"
  },
  "public_name": "SenTient",
  "required_capabilities": [
    "sentient_isolated_analysis"
  ],
  "routes": [
    {
      "$schema": "../../../docs/contracts/artifact-contracts/route-contribution.schema.json",
      "aliases": [],
      "availability": "conditional",
      "capability_policy": {
        "denied_behavior": "disabled",
        "required_capabilities": [
          "sentient_isolated_analysis"
        ]
      },
      "deep_link_allowed": true,
      "default_label": "SenTient workbench",
      "label_key": "sentient.workbench",
      "module_id": "sentient",
      "offline_behavior": "degraded",
      "page_ref": "subsystem://sentient/interface/workbench",
      "path": "/sentient",
      "route_id": "sentient.workbench",
      "safe_fallback_route_id": "sentient.workbench"
    },
    {
      "$schema": "../../../docs/contracts/artifact-contracts/route-contribution.schema.json",
      "aliases": [],
      "availability": "conditional",
      "capability_policy": {
        "denied_behavior": "disabled",
        "required_capabilities": [
          "sentient_workbench_jobs"
        ]
      },
      "deep_link_allowed": true,
      "default_label": "Workbench jobs",
      "label_key": "sentient.jobs",
      "module_id": "sentient",
      "offline_behavior": "degraded",
      "page_ref": "subsystem://sentient/interface/jobs",
      "path": "/sentient/jobs",
      "route_id": "sentient.jobs",
      "safe_fallback_route_id": "sentient.workbench"
    },
    {
      "$schema": "../../../docs/contracts/artifact-contracts/route-contribution.schema.json",
      "aliases": [],
      "availability": "conditional",
      "capability_policy": {
        "denied_behavior": "disabled",
        "required_capabilities": [
          "sentient_candidate_artifacts"
        ]
      },
      "deep_link_allowed": true,
      "default_label": "Candidate artifacts",
      "label_key": "sentient.candidates",
      "module_id": "sentient",
      "offline_behavior": "cached_read_only",
      "page_ref": "subsystem://sentient/interface/candidates",
      "path": "/sentient/candidates",
      "route_id": "sentient.candidates",
      "safe_fallback_route_id": "sentient.workbench"
    }
  ],
  "sidebar": {
    "$schema": "../../../docs/contracts/artifact-contracts/sidebar-navigation.schema.json",
    "items": [
      {
        "availability": "conditional",
        "badge_provider_ref": null,
        "icon_ref": null,
        "item_id": "sentient.workbench",
        "label": "SenTient workbench",
        "label_key": "sentient.workbench",
        "order": 0,
        "required_capabilities": [
          "sentient_isolated_analysis"
        ],
        "route_id": "sentient.workbench"
      },
      {
        "availability": "conditional",
        "badge_provider_ref": null,
        "children": [
          {
            "availability": "conditional",
            "badge_provider_ref": "koa://integrations/sentient/job-status",
            "icon_ref": null,
            "item_id": "sentient.jobs",
            "label": "Jobs",
            "label_key": "sentient.jobs",
            "order": 0,
            "required_capabilities": [
              "sentient_workbench_jobs"
            ],
            "route_id": "sentient.jobs"
          },
          {
            "availability": "conditional",
            "badge_provider_ref": "koa://integrations/sentient/candidate-count",
            "icon_ref": null,
            "item_id": "sentient.candidates",
            "label": "Candidate artifacts",
            "label_key": "sentient.candidates",
            "order": 10,
            "required_capabilities": [
              "sentient_candidate_artifacts"
            ],
            "route_id": "sentient.candidates"
          }
        ],
        "icon_ref": null,
        "item_id": "sentient.activity",
        "label": "Workbench activity",
        "label_key": "sentient.activity",
        "order": 10,
        "required_capabilities": [
          "sentient_workbench_jobs"
        ]
      }
    ],
    "module_id": "sentient",
    "visible_depth": 2
  },
  "topbar_widgets": [
    {
      "$schema": "../../../docs/contracts/artifact-contracts/topbar-widget.schema.json",
      "activation": {
        "command_ref": null,
        "kind": "route",
        "route_id": "sentient.workbench",
        "status_provider_ref": null
      },
      "compact_only": true,
      "icon_ref": null,
      "kind": "action",
      "label": "Open SenTient",
      "label_key": "sentient.open",
      "module_id": "sentient",
      "offline_behavior": "degraded",
      "priority": 30,
      "required_capabilities": [
        "sentient_isolated_analysis"
      ],
      "scope": "module",
      "slot": "primary",
      "widget_id": "sentient.open"
    },
    {
      "$schema": "../../../docs/contracts/artifact-contracts/topbar-widget.schema.json",
      "activation": {
        "command_ref": null,
        "kind": "status_provider",
        "route_id": null,
        "status_provider_ref": "koa://integrations/sentient/job-status"
      },
      "compact_only": true,
      "icon_ref": null,
      "kind": "status",
      "label": "Workbench status",
      "label_key": "sentient.job_status",
      "module_id": "sentient",
      "offline_behavior": "degraded",
      "priority": 40,
      "required_capabilities": [
        "sentient_workbench_jobs"
      ],
      "scope": "module",
      "slot": "status",
      "widget_id": "sentient.job-status"
    }
  ]
}
